2018年,09月,4,"機上娛樂設備仍使用傳統按鍵式控制器，且須搭配專屬耳機插孔，在現今主流提供觸控螢幕的航空公司來說，是稍嫌不足，但整體來說服務及餐點都仍讓人滿意，雖然空服員的贆情跟語氣略帶點冰冷，但考量台灣跟北京之間約2.5小時的里程，空服員準備餐點就已經焦頭爛耳了，我想這也難怪一登機，便可見牆上鏡子旁的標語 - ""Speak Softly, Work Gently"""
2018年,09月,5,機上軟硬設施齊備：絨布座椅乘坐舒適，電視娛樂設備適合；人員服務態度親切：資深空服人員親切，服務細節熟練流暢；推薦優先選擇搭乘！
2018年,09月,5,食物好吃，服務好，笑容佳，食物有採用台灣本土品牌，作為零嘴，非常好吃，海鮮飯簡直高級，原本以為會是罐頭，制服漂亮
2018年,09月,4,坐位正常，不會到太小，娛樂裝置正常，還可以在更新一下會更好，餐點內容也算正常，還不錯吃，空姐服務都還不錯，還算滿意
2018年,09月,4,"可能是舊機型的緣故, 個人娛樂系統螢幕很小, 座椅稍稍後傾就看不太清楚了, 操控手把的標誌已經磨損看不清楚, 系統對按鍵的反應也很慢.但是餐點很好,尤其是沙拉的生菜非常美味. 空服人員的態度及對應也非常好. 有機會應該會再搭乘."
2018年,09月,3,沒有覺得特別好或不好之處，可能機上的旅客較多，機組人員比較忙碌，所以也沒有感受到有什麼特別細心或照顧的服務。
2018年,09月,4,班機沒有提供個人螢幕，只能有公用螢幕，前往富山，卻播放台灣娛樂節目，似乎順序顛倒了，建議播放介紹北陸的影片，比較實用
2018年,09月,5,商務艙座位非常舒適，餐點擺盤很美也還算可口，酒單選擇也很多，但我個人不喜歡粉紅香檳!歐洲段沒有提供羊毛被，美中不足!
2018年,09月,5,空服員態度親切，在航程中提供必要的服務，主動給予旅客關心，希望很快能夠再有機會搭乘，推薦給要來台灣旅遊的外籍旅客
2018年,09月,5,服務品質和搭機舒適度大致都蠻好的，是值得選擇的航空公司。有些資深的空少和空中小姐，也都是很專業又客氣。
2018年,09月,4,"高雄機場的華航貴賓室整修中,不過華航有提供餐卷使用,高雄出發的飛機都是中小型的,設備還是沒有桃園飛的好,不過沒有誤點.整體來說服務還可以."
2018年,09月,3,一直以來幾乎都是坐華航出國，但這次有點失望，餐準備的不夠，坐在中間位子的最後牛肉餐不夠，只剩下海鮮飯，結果同行的家人有人不吃海鮮，最後反應也是無法解決……
2018年,09月,4,空間比經濟艙大很多 很舒適，餐點是和經濟艙一樣的，飛機上的個人視聽螢幕很大，飛機上很多近期新片可以觀賞，整體來說非常棒！
2018年,09月,5,航空公司，而且該航線是直飛很方便！！
2018年,09月,4,這次居然買到747的upper deck，實在太棒了，腿伸直都碰不到前面的椅子，座位旁邊還有放東西的地方，電影選擇少了一點，但因時間短，所以也無所謂，只是座椅的扶手上有用過的牙籤，不過經過反映，馬上來清理，食物普通，有機會還要買這種座位。
2018年,09月,2,8/29早上達成中華航空CI531往青島流亭機場，預計出發時間是9：20，估計大約9：00大家就已坐上飛機等待起飛。結果因為種種因素，包括行李轉運問題，延遲到將近11：20才起飛，讓乘客在飛機上乾等2個小時，機上娛樂設備也不能用。僅僅只發放一人一包小花生打發。相關危機處理及客戶安撫完全不合格。真的是令人印象深刻的傻眼。
2018年,09月,4,從香港出發到阿姆斯特丹的機場大概用上16小時， A350舒適有私隱的感覺設計， 完全可以平躺，只是如可以闊落一點會更好， 中華航空的服務人員品質很好， 又親切態度， 飛機餐還可以一定可以吃飽， 味道算是可以， 過夜包很貼心品質也很好， 但過夜包的外觀很普通，香港到台北轉機當晚時間較趕，在台北桃園機場指不太清楚， 也沒甚麼服務員提供指示； 阿姆斯特丹回程台北時候延誤了一小時起飛，服務員很快便派上小吃及飲料， 整體都滿意。
2018年,09月,5,大概是之前去新加坡都坐廉價航空，這次坐華航去覺得經濟艙的位子其實滿大的。不過餐點上仍然是普普通通，希望可以再好吃一點。
2018年,09月,4,對於我們台灣要飛歐洲直飛的選擇並不多 不過華航是台灣唯一直飛的航空公司 相較於轉機的確可省下不少時間 這次跟老婆蜜月旅行雖然搭經濟艙 但幸運選到最前排的位子 腿部空間當然是超大 不過機上空姐的態度有待加強 希望臉上能多點笑容
2018年,09月,3,去台灣分別坐過3間航空公司，中華航空的飛機餐是最好吃的，其他2間有時候完全是垃圾，今天有小意外 竟然坐到細機，沒有電視看超失望，每次我都是一齣電影分來回程看，因為去台灣機程短 不夠看完，還要delay40分鐘才起飛
2018年,09月,5,此行為直飛班機使用A350新型飛機，空間舒適且設備新穎，航班時間為台北早晨班機到達目的地為當地當日下午時刻，對於想充分多一點時間遊玩的旅客，是一個很棒的選擇。
2018年,08月,5,華航的空姐都很甜美親切，747-400每次搭程都會覺得很興奮，很舒適而且機艙裡不會有異味感，比較不容易暈機。大推，心目中的第一
2018年,08月,2,溫哥華機場應該算是加拿大西岸最大的機場，然而機場貴賓室，除了場地還不錯外，提供的餐飲，可真糟透了，竟然還貼出已打烊的告示，擺在餐飲台上的只有一些殘羹，從未見過如此的貴賓室。
2018年,08月,4,這次從台北飛三亞是華航的B737-800飛機算是舊型，座椅沒有AVOD個人娛樂系統，位子空間也比較小！但是空服組員服務非常的貼心也很棒，餐也不錯吃，紅燒獅子頭喔！希望華航下一代窄體客機的座椅可以裝AVOD！
2018年,08月,3,從上海返回桃園機場，因登機時間不明延誤，致上了飛機後，以為會比預定時間晚到桃園，但機長以非常快的速度在空中飆機，感覺非常厲害，唯一美中不足的地方是，我們的用餐時間縮短，差點來不及在下飛機的時候吃完。
2018年,08月,5,這次到北海道，來回都是坐華航的飛機，機型是Boeing 777-300ER，去回的上升與下降都頗穩定，蠻欣賞這個機型和機長的技術。經濟艙的座位以170公分的我來說頗舒適，坐下來後，膝蓋到前方座位還有至少1-2拳頭的距離，座位上除了良好的螢幕（對比一樣是華航，但四月份去首爾時看到的爛爛螢幕），還有USB槽，靠腰墊和頸枕等，讓飛行過程不會不舒服。倒是這次回程的餐點，印象中是海鮮烏龍麵和三杯雞兩種選擇，我和太太都選了三杯雞，吃了後都覺得好吃，不像過去吃的空中餐，總有著滿滿的微波味！機上的服務則是一貫的良好，但有趣的是，回程的空姐們在對話時頗俐落，不只是不說贅字，語氣和音調還完全不拖泥帶水，表情是帶專業但不帶笑容，但這種不帶笑容的表情，又不會讓人覺得不舒服，頗有趣啊。
2018年,08月,5,這次在阿姆斯特丹機場從經濟艙升等為豪華經濟艙，機艙設計由台灣的陳瑞憲設計師所操刀設計，水郵山驛的設計語彙，客艙中充滿了柿木紋的裝飾，在這個艙等可以有自助零食吧，讓洲際旅程中隨時可以拿一些零嘴享用。
2018年,08月,4,這次出國好像剛好是沖繩旅遊的旺季，聽說位置都滿了，我們團員中有幾位是被安排在出口座位，櫃台托運行李時服務人員都面帶微笑非常細心核對資料，也一一確認我們的身體健康狀況，登機後空服員也親切耐心的再跟我們解釋一些細節，每個環節都不馬虎，是讓人覺得安心並值得信賴的團隊。
2018年,08月,2,預定在維也納返台的飛行途中完成部分工作，因為機上WiFi故障，以致無法完成工作與對外聯絡，機上設備可靠度待加強。
2018年,08月,4,無論是地勤和空姐們，服務都很不錯，餐點還不賴、座位舒服、飛行鰻平穩的，看了一部電影，非常謝謝服務人員們，辛苦了!
2018年,08月,5,8/2-8/6搭乘中華航空公司，往返上海及高雄，感覺上空中服務人員，男性比女性多，雖然如此，還是維持一貫的親民服務態度。下回出國旅遊，還是會繼續選擇華航班機。
2018年,08月,1,2018年8月10日搭乘00:10飛往阿姆斯特丹CI73班機，原本懷抱著愉快的心情，要和老公去國外度蜜月～這是我們第一次搭乘華航班機，老實說，上飛機前心裡是既期待又興奮的～但是！！！當天飛機上的客服員吳遙@小姐，我不知道你到底發生什麼事！從頭到尾臉超！級！臭！服務態度更是差！跟我想像中「親切友善的華航空姐」印象完全不一樣......結束了13個小時長途飛行，下飛機時，我們前面穿插了幾個法國人一同排隊等下飛機，華航空姐看到這些外國人，態度就非常客氣的說「Thank you~」，但輪到我們這些台灣人要下飛機時，某幾位華航空姐笑都沒笑也就算了，連句話都沒說......（謝謝或什麼之類的話）當下覺得，大家都是台灣人，本是同根生，相煎何太急......台灣的空姐怎麼會對自己本國人怎麼這麼不友善，難道他是空姐就這樣看不起台灣人！？總之～搭乘華航初體驗，讓我留下極度差的印象！下次旅行或者朋友詢問，我大概都不會搭乘或者推薦華航了！雖然我不是坐頭等艙，但是我也有付錢啊～～～又不是坐霸王飛機......為什麼要這樣看你臉色呢......
2018年,08月,4,整體的感覺很好，飛機餐也越來越進步，服務人員的態度相當好，雖然不是大飛機，但是起降平穩，足見機師訓練有素，服務和安全是旅行中最重要的兩件事，華航有做到。
2018年,08月,3,"若不想從上海進蘇州.最快就是搭到無錫,所以除非意外,不然每次去蘇州,都是買華航飛無錫的票..座位,餐點都一般,但行程時間短..所以這些就不是很重要了.."
2018年,08月,3,"這次運氣很不好,居然遇到延重delay,有二個半小時吧..回到台灣都半夜一點半了,而無錫機場很小,也沒有什麼店家,所以delay時是有提供便當,但便當看起來不優...另外因為是一個人也不想去拿,因為起來後就會沒有位子坐了...之前都是選素食,這次改選水果餐,現在水果那麼便宜,結果份量好少喔...但從蘇州回台的話,還是無鍚飛會比較近..另外最近票價真的便宜不少,跟客源減少有很大的關係"
2018年,08月,5,這次跟其他同學參加海外參訪，第一次搭華航去泰國，想說試看看商務艙，沒想到真的蠻舒服的，服務人員會主動詢問跟提供我想要的東西，有種被在乎的感覺，機長也感覺蠻有經驗的，遇到亂流都蠻穩的，降落時也沒有什麼太大的搖晃，棒!
2018年,08月,4,"服務人員親切, 餐點吃起來比較不像是便當加熱過的感覺. 經濟艙座位較小, 前後距離較短, 對高個子的人會辛苦些. 整體在80分以上."
2018年,08月,4,空服人員的訓練有素，讓人可以很快適應，飛行座位略嫌壅擠，餐點尚可但紅酒不錯，而且我牙齒疼痛，服務人員還特別拿來一帶冰塊讓我冰敷，緩解大部分疼痛。
2018年,08月,5,"因為之前已經去泰國有十幾次 , 以往都搭長榮航空或泰國航空 , 從未搭過中華航空商務艙 , 服務人員態度良好 , 有賓至如歸的感覺 ,"
2018年,08月,5,經常飛行對於空中服務已經習以為常沒有太多感受，但此次因為慶生所以飛行! 雖然航空公司不會客製化甚麼服務也不會有人發現你生日，但整體來說這趟飛行得到有效率面帶溫暖笑容的服務及舒適的空間。 謝謝專業的空服團隊
2018年,08月,3,CI537是屬於中型的飛機，左右各三排，中間是走道，若是空服人員要送餐又有人要如廁極度擁擠，沒有個人電視，每隔三排才有一個小小的螢幕在天花板上面，舒適度比虎航略好一些，不過當然是比不上大飛機的寬敞與舒適！這是單就飛機硬體而言。。在飛航過程中，旅客也是很重要，飛去三亞，後方有兩位高雄林姓小朋友，哇—-真是開了眼界，一樓路上一直不停說話與兄弟吵架，還有狂踢前面座椅，更厲害的是有軟骨功，可以在他的座位下方鑽到後面的座位換位置，還可以再度鑽回來，是台灣人。
2018年,08月,4,今年我去沖繩，搭個是A330，雖然機齡只有6至7年，但是機上的AVOD解析度度有夠差，而且配上早上刺眼的陽光，完全看不清楚。除此之外，機上餐只有一個雞捲，難吃死了，但比國泰的好吃一點。
2018年,08月,4,"餐點好吃, 按服務鈴也很快會有空服員過來詢問. 不過親切度不是每位空姐都很好, 回程剛好遇到前排是空姐認識的人, 坐了13小時左右的飛機, 就看到前排一直不斷被空姐關照, 食物禮物不停的送."
2018年,07月,5,整體服務不錯，餐點好吃而且服務人員服務態度很好，機上娛樂的電影非常的新，我這趟來回旅程都在看電影，很適合家庭旅遊搭乘。
2018年,07月,3,新千歲機場應該是北海道地區最大的機場，機場貴賓室提供的餐飲卻顯得簡單，一些可頌、飯糰外，只有泡麵。這個時節北海道地區的水果，很有名氣，貴賓室內卻見不到水果。還好，飲料的選擇性尚可。
2018年,07月,5,如果想要有寬敞的腿部空間、較舒適的座椅而又不想負擔太多費用搭乘商務艙，那建議選擇豪華經濟艙，這樣上述的條件均可享受到。華航空勤組員一貫的親切態度是選擇這間航空公司最主要的理由，機上的餐點也較其他國籍航空來的好。
2018年,07月,5,"每次座華航都可以看到很新的電影,所以在飛航的旅程中晃眼就到達目的地了,而且華航的餐點都會有一些在地的點心,我覺得這是很好的做法"
2018年,07月,4,機上餐點，電影，水準之上，空服員服務態度也很好，這條航線每年必坐一次，時間多選擇多，飛的算平穩舒適，評價不錯
2018年,07月,3,石垣島離台灣太近，表訂飛行時間55分鐘，這班飛機是14:35(日本時間)起飛，14:30(台灣時間)抵達，因為飛行時間小於時差，才有降落時間比起飛時間還早的有趣班表。實際飛行時間約45分鐘，起飛沒多久就看見龜山島。
2018年,07月,3,石垣島所在的八重山群島距離台灣非常近，可惜只有夏天一週兩班飛機前往。因為是季節性冷門航線，華航使用波音737-800單走道飛航，沒有個人娛樂系統。不過因為航程太短，一下子就到了，也沒有時間看電影。石垣島是自然環境保護很好的海島，航班太少實在很可惜，因為是唯一的航線，暑假期間票價也不便宜。
2018年,07月,5,還不錯～機上餐點也很好吃～還有電影或音樂可以聽～空服員態度也很好～很客氣～需要什麼都會幫我們服務，抵達時間也很準時
2018年,07月,5,整齊乾淨，守治序，治安很棒，建築物都有粉刷，雖然有四十年的國宅，看起來像新蓋的，關乎國家形象，提升旅客到訪的意願
2018年,07月,3,出發前23小時突然用EMAIL通知搭機時間往後延12小時，導致我們第一天行程被迫取消，原本搭機時間是下午五點左右，往後延12小時變成凌晨4點半起飛，增加我們行程上的成本(計程車資)，有些人甚至因為交通不便，只好提早好幾個小時到達機場等待，結果華航什麼都沒說，還是同行的友人自行打電話客訴才得到車資補貼(實報實銷)，所以如果再有這樣的情況產生，請務必保留增加成本的收據。
2018年,07月,5,飛曼谷相當便宜，也有行李公斤數可以帶回戰利品。餐點表現可圈可點，不知道為什麼覺得比其他航線好吃許多。空姐的態度很好，全程帶著笑容，地勤也是很親切的幫我們check-in。飛行過程也相當舒適，準時到達。
2018年,07月,3,"對長途座機的旅客來說,局限的空間真的很吃不消,在非供餐時段有時肚子餓想要個餅乾吃,居然是:今天機上人多餅乾已不?,有點傻眼,不過是餅乾而已,我以為這種小東西應該會多備...只好餓著等供餐時間到來.唯一的優點是空姐都很親切"
2018年,07月,5,"空服人員親切,餐點也很好吃,機師的技術也很不錯,座位乾淨,機上影片很新,常可以看到新的影片,不論是搭長途或是短程都感覺舒適,"
2018年,07月,4,"1.短程來說,搭過港龍,僅提供大亨堡或者類似Subway的簡餐,但華航能夠提供完整的餐點,這點是給予肯定的。2.服務人員親切/熱心"
2018年,07月,5,這次去雪梨來回搭乘華航主打的A350，不得不說真的很讚，經濟艙座位感覺頗寬，重點是腳可以伸直到前方座位下不會卡住！這個超讚！以前都覺得長榮最好，近幾年覺得華航比較優哈哈，不論在航點拓展佈局，還是飛機汰舊換新上面，都有很明顯的意圖跟進步，相較之下感覺BR比較沒有在前進（倫敦維也納還在搞曼谷中停，人家花花都直飛還新飛機...）在起飛前空姐就端飲料給大家喝，之後又再發了一次（不包含送餐的飲料），整趟下來喝了好幾杯～而飛機上兩餐都蠻好吃的，其實本人一直都蠻喜歡華航的飛機餐，他們的飛機餐味道都有到的感覺，不會太鹹也不會太淡。在雪梨機場報到的時候，發現排隊有一大半的人是外國人，深刻感受到華航主打外國旅客赴台轉機的策略有成功！（因為印象中以往華航飛機上大多是台灣人吧）總之，這次搭華航往返雪梨的感想大致如上，很滿意，空姐空少也都超體貼，覺得搭了很有溫度的飛機，真心覺得華航進步很多。
2018年,07月,4,意外的發現有些班次，華航提供買經濟艙，坐商務艙的優惠，當然，餐食沒有優待，還是經濟艙的等級，check in和行李重量也是經濟艙等，不過飛北京三小時能坐寬敞的二樓商務艙，非常划得來。我猜是華航利用比較老的波音747-400機型，反正機型舊，搭商務艙的人不多，乾脆福利一下吧。回程竟然也搶到二樓商務艙，很幸運。
2018年,07月,5,高雄到香港的飛行十分的短，但華航還有提供完整的一餐，覺得相當驚奇。對整體的服務感到相當滿意。由於是到香港轉機，連行李一併掛到別家航空公司，不用自己掛，十分方便。
2018年,07月,5,這條航線是用華航最新的A350執非，豪經艙的擺設相當典雅，空間椅距大，耳機相當有質感，能夠阻絕飛機上的噪音。娛樂設備相當靈敏，選擇多樣。自備泡麵請空服員協助加熱水，空服員也相當熱情，還提供環保筷使用，相當貼心。飛機餐一直維持華膳空廚一貫的水準，還提供哈根達斯冰淇淋，真是太棒啦！
2018年,07月,4,以前坐華航起飛、降落都很不舒服，這一次反而很不錯，地勤的表現也很好很親切，但這一次的餐點不太好吃，雞腿排飯的肉真的很硬不入味，醬汁太鹹不好吃，另外，吃飯時間真的超級趕、又沒有飲料有點可惜，但華航有進步了
2018年,07月,4,從櫃檯到機位坐定 都有賓至如歸的感覺 洛杉磯機場的SKY TEAM貴賓室也增加了一些東方食品 符合使用貴賓種族比例原則，機上餐飲可口 半夜餓了也有多種小點可選擇 不是只有泡麵而已 機上娛樂電影也豐富了許多 讓你在機上十幾個小時 不會無聊 值得鼓勵
2018年,07月,4,飛機的商務艙位置舒適～飛機新穎～華航在吉隆坡的貴賓室小巧，位置並沒有很多～熱食選擇雖不多但是口味尚可～進入吉隆坡貴賓室的當日發現女廁無法使用...至少待了幾小時的時間～禁止使用的牌子都沒拿開過，不知道是清潔還是損壞...
2018年,07月,1,我在今年大約二月初乘坐華航，有一位女士將他的行李放置我頭上，所以我和空服人員詢問此事。空服人員卻向我表示說：因為這個個國家的人民（越南 胡志明市）的不是開發國家的人，所以素質不是那麼好，這個國家的人，就是這樣的，諸如此類，這種種族歧視性的話語，然後他們每次坐飛機，都是喜歡把東西帶很多上飛機。我想知道這和我向空服人員問的事情有關析嗎？為什麼要在公開場合說這種歧視性字眼，在一堆越南人面前，不表示尊重。身為一個空服人員，說這種言論合適嗎 我無法容忍這種航空公司，再也不願意做這家航空公司了
2018年,07月,4,因為此航線搭乘人數不及台北飛往其他大都市，班級是左右各三位的小飛機，且沒有個人螢幕等設備。但因為時間約2~3鐘頭，倒不影響旅遊興致。但是訂機票時選的位子跟後來左右各三的位子有異，訂完機票記得注意一下!
2018年,07月,5,久聞華航A350的豪經艙很不錯，這次出差總算有機會體驗，臨時從經濟艙被升等豪經艙，好開心。 座位寬敞、螢幕也很大，還有抗噪耳機，連洗手間也很寬敞，飛機餐也進步，還有哈根達斯冰淇淋，很期待下次再一次搭乘。
2018年,06月,5,華航的地勤、機上服務都是不用?的讚。這次帶寶寶（1?多）搭乘了兩岸航?，空姐格外熱情，還送了有華航飛機圖案的貼紙，這是搭乘其他航司沒有過的體驗。而且全程很照顧我們2人，問是否需要服務，雖然帶著寶寶很累，但是遇到這?舒心的空乘人員，也是值了。
2018年,06月,5,雖然是小飛機，不過很舒適，服務人員態度都很好，餐點也不錯吃，尤其是小餅乾，我吃好多個，我隔壁不吃都給我吃，潛艇堡也不錯，去程吃火腿的，回程吃燻雞的，口味都不錯
2018年,06月,4,飛航日本的班機，可能是還要轉飛其他地區，都比較新比較大，比較舒適，每個座位都有影音設備，餐也比較好吃
2018年,06月,3,飛機都不大，有點老舊，餐點內容也簡單，座位小又擠，還好飛航時間不久，降落跑道時聲音比較大，多忍耐一下
2018年,06月,4,家在台北市區，要到上海浦西出差，走松山搭華航是非常方便的選擇ˊ。到機場很快速，出境的人不多通關很快，到達虹橋之後入關的也不多，之後搭地鐵就可以到達目的地，整趟行程時間大大縮短，這就是最大的方便了!
2018年,06月,5,超級貼心的空服組員，從阿姆斯特丹回台北的回程上，超級貼心的空服組員，不斷關心所有乘客的需求。在後方廚房也備有許多點心供給大家食用，還會與乘客聊天。有訂餐的也很快速的優先上餐，還有特調酒類可以點選。
2018年,06月,5,雖然起飛期間有延誤，但上飛機後，空服的服務真的很貼心也處處關心所有乘客。機上飲食真的很不錯，謝謝當天航班的空服組員。
2018年,06月,5,"飛機環境乾淨, 座位舒適，而且每次搭乘的班次都很準時起飛。 機上服務人員態度親切友善和有禮貌, 熱食飛機餐最吸引, 所以每次到台灣都一定選擇華航!"
2018年,06月,4,華航原定的機型為A330，後來更換成A359，新機果然舒適，比起國泰的A359，華航設計的元素，更是令人讚賞，商務艙的和風餐點是委託大倉製作的，果然水準之上。如果華航每架飛機都是這樣的等級，幹掉卡達與阿聯酋指日可待。
2018年,06月,5,前往洛杉機之遙，但平穩舒適的空間與航行，讓前往探險與度假的人們，擁有休憩與夢境的交錯時間，華航是旅途之鷹。
2018年,06月,4,香港到高雄的航班不多，這次挑了比較平宜的中華航空，飛行時間只有一個小時左右，所以也不用太講究。之前中華航空把飛機餐改為吃麵包而已，我已經有一段時間沒有搭了，不過現在已經恢復正常餐食服務，所以這個價格來說是可以接受，所以再次選搭。不知道是否因為是在旅遊公司買的機票關係，不能在給我預選坐位，需然也是靠窗的位置，但是卻是第一排，在機門旁的位置，因為同行的是比較年長的家人，坐在機門旁還要有一些重要的事項要注意，例如是逃生是在這個位置必須要做的事情，覺得對於年長的客人來說是有點難，航空公司應該有空間的去調配才對。
2018年,06月,4,因為飛機遲到，延誤了半小時。今次是第三次乘搭中華航空了，和以往一樣，服務還不錯，主要是班次多，可以遷就不同的旅客，會繼續乘搭。
2018年,06月,4,"個人還蠻常選中華航空這間公司, 但還是會以價錢為優先考量, 這次飛浦東餐點也是還可以, 機上的影音也是我期待的.空姐也是很親切, 位子上來說算舒適, 因為本人也不高所以這沒什麼問題."
