由於航空公司服務人員的服務讓我對這家航空公司充滿信心,,,
我覺得搭乘這間航空公司的班機很安全,,,
這家航空公司的服務人員對我一向很有禮貌,,,
這家航空公司的服務人員有足夠專業的知識來回答我的問題,,,
訂票過程令人安心,,,
航空公司重視飛航安全,,,
服務人員語言能力佳,,,
本次所搭乘航空具有良好的聲譽,,,
本次所搭乘航空服務人員具有專業的知識與專業,,,
本次所搭乘航空服務人員能維持一定的服務水準,,,
本次所搭乘航空服務人員禮貌週到具親切感,,,
廉價航空員工敬業行為會建立顧客的信心,,,
廉價航空員工對顧客的禮貌性,,,
廉價航空員工具有專業知識,,,
該航空公司服務人員的態度良好,,,
該航空公司人員的服務方式是讓旅客信任的,,,
我覺得服務人員的親切服務讓我對這家航空公司充滿信心。,,,
我認為在這間公司消費很安全、個資不會外洩。,,,
我覺得服務人員對我很有禮貌。,,,
我覺得服務人員有足夠專業的知識來回答我的問題。,,,
我覺得我搭乘的這家航空公司飛行的安全性讓人放心,,,
我覺得我搭乘的這家航空公司空服員會在旅客面前擁有自信且專業的態度,,,
"我覺得我搭乘的這家航空公司空服員會隨時對旅客保持
謙誠有禮的態度",,,
我覺得我能信任這家航空公司的空服員,,,
